Title,Price,Subscribers,Reviews,% of Subscribers who Left Reviews,Length (Hrs)
JavaScript - Become Higly Paid Front End Developer,105,710,137,19.295774647887324,3.5
Object Oriented Programming (OOP) in PHP - Build An OOP Site,20,6588,721,10.944140862173649,2
Beginners Introduction to Web Development,200,7331,55,0.7502387123175556,1.5
Django + AngularJS for a Powerful Web Application,95,4463,59,1.3219807304503697,5.5
WordPress Academy: Learn WordPress step by step,150,1873,360,19.220501868659902,7.5
Web Development Essential Skills - Complete HTML and CSS,95,1388,11,0.792507204610951,7
Byte-Sized-Chunks: Closures in Javascript,20,1292,2,0.15479876160990713,2
Laravel Account Activation Project,50,1147,19,1.6564952048823016,2.5
WordPress: Create an Amazing Website With Ease,200,1109,13,1.1722272317403066,2.5
Mastering the Google Chrome Developer Tools,20,2002,41,2.047952047952048,0.67
Kali Linux Web App Testing,75,876,48,5.47945205479452,3
Learn Ruby Programming The Easy Way - Lite,20,1186,12,1.0118043844856661,0.57
"Web Scraping with Python, Ruby & import. io",75,973,50,5.138746145940391,4.5
Sending email with PHP: from Basic to Advanced,40,379,58,15.303430079155673,2
WordPress 2016 for Beginners : Build awesome websites!,20,2177,13,0.5971520440973818,4
Learn to make websites with Google's Material Design Lite,20,1063,72,6.773283160865475,5.5
Joomla 3 : Develop a Professional Website in 3 Simple Steps!,35,1309,74,5.653170359052712,5
Complete Python Web Course: Build 8 Python Web Apps,110,7489,941,12.565095473360929,16
Web Design for Beginners: Real World Coding in HTML & CSS,100,9103,1724,18.938811380863452,9
Ethereum Developer: Build A Decentralised Blockchain App,195,3169,527,16.629851688229724,3.5
The Complete Web Development Course -  Build 15 Projects,200,7501,1213,16.17117717637648,76.5
Angular 2 + Rails 5 Bootcamp,150,1967,372,18.91204880528724,9
Javascript - From Beginner to Pro-Build real world JS apps,195,28694,688,2.3977138077646893,11.5
Redux in Angular (2 and 4+),70,909,16,1.76017601760176,1.5
The complete JavaScript developer: MEAN stack zero-to-hero,75,4820,983,20.394190871369293,11.5
Running a Web Development Business: The Complete Guide,150,24575,525,2.136317395727365,19.5
Projects In JavaScript & JQuery,60,9109,620,6.806455154243056,9
Learn To Build Beautiful HTML5 And CSS3 Websites In 1 Month,50,18818,407,2.162822829206079,11
"Full stack Universal React with Redux, Node js and MongoDB",195,1121,174,15.521855486173058,5
Creating an MP3 Player with HTML5,20,14551,169,1.1614322039722356,1.5
Be a Bootstrap Developer from scratch,100,5800,185,3.189655172413793,3.5
Create Your First Wordpress Site in Under an Hour,20,4867,128,2.6299568522703924,1
Learn Coding as RF or Telecom Engineer - Build Real Program,25,1006,4,0.3976143141153081,2
Creating FaceBook Design Using Bootstrap - Handson Project,80,4616,20,0.43327556325823224,2
Building HTML5 Canvas projects from scratch,100,8968,35,0.3902765388046387,2
Learn How To Become a Web Developer From Scratch,200,7062,72,1.0195412064570943,11
"Earn Big Profits With Web Development, Simple and Easy!",90,3073,27,0.8786202408070289,1.5
BDD with Ruby on Rails using RSpec 3 and Capybara,175,2706,179,6.614929785661492,13
Learn By Example: jQuery,50,1702,49,2.8789659224441833,7
Professional Python Web Development Using Flask,120,3420,489,14.298245614035087,14.5
JavaScript HTML CSS Project make a Quiz Tutorial,95,7130,39,0.546984572230014,2
Voiceover Audio Secrets - Your Way to Top Audio Quality,195,918,8,0.8714596949891068,2.5
jQuery UI In Depth,25,1520,21,1.381578947368421,10.5
Codeless Website Development with Adobe Muse,50,461,67,14.533622559652928,3.5
Learn To Build A Google Map App Using Angular 2,30,116,12,10.344827586206897,1
Learn Reactivex From Ground Up,40,207,32,15.458937198067632,5
Learn HTML in 59 Minutes - Your intro to front-end dev,35,333,15,4.504504504504505,1
WordPress Theme Customization 101 (for beginners),40,305,40,13.114754098360656,2
Supercharging Development With Atom Text Editor,20,644,42,6.521739130434782,1.5
Master WCF 4.0 From Scratch Using C#,50,415,67,16.14457831325301,7
Drupal 7 for Beginners,35,926,102,11.01511879049676,2.5
Critical Web Dev Skills & Tools for the Non-Tech Hustler,Free,3118,8,0.2565747273893521,1.5
Install WordPress on Computer using XAMPP,Free,4290,150,3.4965034965034967,0.62
Java Web Services Part 2,20,959,51,5.318039624608968,3
Complete PHP Course With Bootstrap3 CMS System & Admin Panel,195,55332,1225,2.213908768885997,20
Learn To Create WordPress Themes By Building 10 Projects,60,2273,384,16.893972723273208,16.5
The Complete NodeJS Course: Build a Full Business Rating App,195,17784,260,1.461988304093567,12.5
Master the MEAN Stack - Learn By Example,195,25799,382,1.480677545641304,4.5
First Web Application with Spring Boot,40,2865,95,3.315881326352531,4
HTML5 and CSS3: Learn Web Design with HTML + CSS + Bootstrap,200,346,28,8.092485549132949,8.5
Backbone Tutorial: Learn Backbonejs from Scratch,90,4957,634,12.789993947952391,5.5
AngularJS Custom Directives with Dan Wahlin,75,4128,434,10.513565891472869,6
Angular 2+ with Typescript - Essential Training,195,29348,780,2.6577620280768706,3
Learn Angular 2 from Beginner to Advanced,195,32696,526,1.608759481282114,10
Create an eCommerce Wordpress Website 2016 - New Divi Theme!,30,3503,123,3.5112760491007706,4
HTML5 and CSS3 : Landing Pages for Entrepreneurs 2016,195,2354,16,0.6796941376380629,4
Learning Docker and Kubernetes by Lab,30,586,54,9.215017064846416,5
Projects in ExpressJS - Learn ExpressJs building 10 projects,50,1949,149,7.644946126218574,15.5
PHP For Beginners : Learn PHP From Scratch!,100,1825,17,0.9315068493150684,3.5
Bootstrap 4.0 New Features: Build Responsive Website,40,2296,28,1.2195121951219512,1.5
ASP.NET MVC 5 Project - CMS and Shopping Cart with Paypal,30,550,97,17.636363636363637,9
Professional RESTful API Design using Python Flask,120,578,25,4.325259515570934,4.5
HTML5 APIs For JavaScript - A Course For Web Developers ,50,7706,62,0.8045678691928367,5
Learn Python Django - A Hands-On Course,50,1339,21,1.568334578043316,2
Comprehensive JavaScript Programming,20,6760,84,1.242603550295858,3
Security for your WordPress site,85,1096,8,0.7299270072992701,0.63
Try Django 1.9 | Build a Blog and Learn Python's #1 Library,50,7407,172,2.3221277170244363,20
Accelerated ES6 JavaScript Training,110,5811,850,14.627430734813284,6
AWS Serverless APIs & Apps - A Complete Introduction,145,2145,166,7.73892773892774,8
Python and Django Full Stack Web Developer Bootcamp,200,11832,1883,15.91446923597025,31.5
The Complete Elixir and Phoenix Bootcamp,50,5279,1375,26.04659973479826,14.5
Build a Real-world App with ASP.NET Core and Angular 2 (4+),190,5332,828,15.528882220555138,10.5
REST APIs with Flask and Python,110,5151,737,14.307901378373131,12.5
Angular 4 (formerly Angular 2) - The Complete Guide,190,73783,19649,26.630795711749318,22
Build Websites from Scratch with HTML & CSS,145,51257,1955,3.8141131942954134,8
PHP for Beginners -Become a PHP Master - Project Included,200,28880,4316,14.944598337950138,30.5
The Professional Ruby on Rails Developer,100,17334,676,3.8998500057690086,17
The Complete Ruby on Rails Developer Course,195,33677,3809,11.310389880333759,31.5
Docker Technologies for DevOps and Developers,30,19210,3137,16.330036439354505,3
JavaScript programming: JavaScript for beginners,55,2215,223,10.067720090293454,5
JSON in Action: Build JSON-Based Applications,50,1322,171,12.934947049924356,3.5
Learn Ruby Programming The Easy Way,35,3485,22,0.6312769010043041,2
Learn OAuth 2.0 - Get started as an API Security Expert,95,2185,283,12.951945080091534,3.5
AngularJS For .Net Developers From Scratch,50,2494,303,12.14915797914996,4.5
"Jekyll: make fast, secure static sites and blogs with Jekyll",45,2091,86,4.112864658058346,2.5
HTML and CSS BootCamp for Beginners,30,1777,35,1.9696117051209903,6.5
Hosting Django: Amazon Web Services (AWS) Fundamentals,45,2573,103,4.003109211037699,5.5
Angular Advanced MasterClass & FREE E-Book,150,228,9,3.9473684210526314,6.5
Learn Responsive Web Development from Scratch,Free,59639,2692,4.513824846157716,4.5
Build WordPress Plugin to extend Beaver Builder,50,1705,26,1.5249266862170088,2
Coding Made Easy: A Beginners Guide To JavaScript,40,1950,33,1.6923076923076923,1
The Complete Developers Guide to MongoDB,150,10945,1286,11.749657377798082,13.5
Electron for Desktop Apps: The Complete Developer's Guide,50,2606,241,9.247889485801995,8
Vue JS 2 - The Complete Guide (incl. Vue Router & Vuex),190,17671,4675,26.45577499858525,18
"React JS, Angular & Vue JS - Quickstart & Comparison",160,2273,288,12.670479542454904,8
The Complete JavaScript Course: Build a Real-World Project,195,27801,4340,15.610949246429984,17.5
Angular (Angular 2 or 4) & NodeJS - The MEAN Stack Guide,150,17297,3166,18.303752095739146,8.5
Angular 2 with TypeScript for Beginners: The Pragmatic Guide,150,40070,8341,20.816071874220114,9.5
Meteor and React for Realtime Apps,140,6527,1384,21.204228588938257,9
The Web Developer Bootcamp,200,121584,27445,22.572871430451375,43
AngularJS JumpStart with Dan Wahlin,75,17802,2144,12.043590607796876,10
The Complete Web Developer Course 2.0,200,114512,22412,19.57174793908062,30.5
Ultimate Web Designer & Developer Course: Build 23 Projects!,200,33788,4434,13.123002249319285,32.5
ExpressJS Fundamentals,Free,21245,914,4.302188750294187,1
REST WCF Service in ASP.NET,Free,7905,561,7.096774193548387,0.68
Projects in Node.js - Learn by Example,195,869,99,11.39240506329114,5
Building Data Visualizations with D3 and Angular 2,125,293,30,10.238907849829351,3.5
Learn Object Oriented PHP By Building a Complete Website,Free,36322,2618,7.207752877044216,4.5
Web Programming Course : Asp.Net MVC,100,2760,76,2.753623188405797,3.5
Learn Spring Framework Practically - Hands On Recipies,145,522,50,9.578544061302683,5.5
One-stop Ruby on Rails: Build Web Applications from Scratch,145,1628,162,9.950859950859952,18.5
Learn what's new in PHP 7,Free,12336,271,2.1968223086900127,3.5
Dive Into Docker: The Docker Course for Developers,Free,6437,313,4.862513593288799,1.5
"Basic Concepts of Web Development, HTTP and Java Servlets",35,2797,59,2.109402931712549,1
The Most Comprehensive Web Development Course,200,333,22,6.606606606606606,42
Learn and Understand AngularJS,175,59361,11580,19.5077576186385,7
JavaScript: Understanding the Weird Parts,175,79612,16976,21.32341858011355,11.5
Webpack 2: The Complete Developer's Guide,75,8964,1893,21.11780455153949,5.5
Build Responsive Real World Websites with HTML5 and CSS3,195,43977,7106,16.158446460649888,12
ES6 Javascript: The Complete Developer's Guide,80,13010,2709,20.822444273635664,6.5
Learn and Understand NodeJS,195,58208,11123,19.109057174271577,13
Understanding TypeScript,110,9132,1560,17.082785808147175,7
Advanced React and Redux,140,21998,3326,15.119556323302119,12
Modern React with Redux,180,50815,15117,29.749089835678443,26.5
Angular Styling & Animations (for Angular 2 and Angular 4),120,4138,307,7.419043015949735,6
The Complete ASP.NET MVC 5 Course,190,20652,6357,30.781522370714704,7.5
GraphQL with React: The Complete Developers Guide,150,6412,987,15.393013100436681,13
"Create a Simple Photo Gallery with Dropzonejs, Slick and PHP",Free,2464,17,0.689935064935065,0.73
WordPress in under an hour - Create/manage your own website!,Free,6474,86,1.3283904850169912,1
Twitter Bootstrap 2 for Beginners,20,2388,139,5.8207705192629815,1
Bootstrap Tutorial - Essentials From Basic to Advanced,195,1494,23,1.5394912985274432,7.5
Create an Engaging Website with Twitter Bootstrap 2.x,20,1463,56,3.827751196172249,1
Javascript :basics for beginners,30,1057,22,2.081362346263009,0.62
CSS Tutorial For Beginners: Style Your Wordpress Templates,35,1049,22,2.0972354623450906,3.5
HTML5 And CSS3 - Build Modern Responsive Websites,175,109,17,15.59633027522936,9.5
PSD to HTML5/CSS3 using Twitter Bootstrap 3! ,95,2073,24,1.1577424023154848,2
Web Development: Make A Website That Will Sell For Thousands,50,1116,62,5.555555555555555,7.5
WordPress Basics to Business: Share and Sell your Expertise,50,1125,10,0.8888888888888888,3.5
PHP Zend Framework 2:Creating a CRUD Application,40,802,6,0.7481296758104738,0.63
JavaScript Fundamentals,Free,4409,71,1.6103424812882738,5
Building a Website With Jekyll,20,686,19,2.7696793002915454,3
Big Data and Apache Hadoop for Developers - Fundamentals,30,1154,89,7.712305025996534,3
Wordpress Development : Create a Custom Wordpress Website,120,885,3,0.3389830508474576,1.5
How to Make a Wordpress Website 2017,Free,2437,137,5.621665982765696,0.57
RESTful Services with ASP.NET Web API,85,716,59,8.240223463687151,2
Web Hosting Fundamentals,20,1867,19,1.0176754151044456,0.62
Learning Path: React: Make Stunning React Websites,200,91,5,5.4945054945054945,6.5
Administering Microsoft SQL Server 2012 Databases - 70-462,60,586,65,11.092150170648464,5.5
PHP CodeIgniter:CRUD concepts in MVC,40,601,4,0.6655574043261231,0.58
Adobe Experience Manager CMS Basics,35,81,14,17.28395061728395,1
Introduction to Frontend Web Development For  Beginners,145,1018,28,2.75049115913556,4.5
PHP: Complete Login and Registration System with PHP & MYSQL,200,1448,173,11.947513812154696,7.5
JavaScript Complete Guide to learning JavaScript,200,1296,22,1.6975308641975309,5.5
Advanced Scalable Python Web Development Using Flask,120,1299,56,4.311008468052348,14
jQuery for Absolute Beginners - Lite,20,1769,49,2.7699265121537593,0.58
HTML Complete Course - Beginner to Expert,Free,20073,615,3.0638170677028844,1.5
Cross-Platform Development with ASP.NET Core 1.0 MVC,35,601,126,20.965058236272878,5.5
Build a Photo Blog with Ruby on Rails,20,2281,32,1.4028934677772906,1.5
Practical PHP: Master the Basics and Code Dynamic Websites,Free,83737,4598,5.491001588306244,6.5
Sass Workflow,Free,20890,945,4.523695548109143,3
Learn PHP Fundamentals From Scratch,Free,48650,1236,2.5405960945529293,2
XML For Absolute Beginners: Learn to create your own tags,75,1945,58,2.982005141388175,1
Joomla: Create a Joomla Website This Weekend With NO CODING!,Free,18496,386,2.086937716262976,2
JavaScript for beginners - A Complete Guide,100,1193,87,7.292539815590946,10.5
Laravel Deployment - Launch your Laravel Application Online,Free,4905,101,2.059123343527013,1
WordPress Development Crash Course: From Zero To Hero,60,1699,8,0.47086521483225424,2
Learn how to create a WordPress theme using Pinegrow,Free,11812,152,1.2868269556383338,2
Learn to Build Web Apps using Laravel Framework,30,746,93,12.466487935656836,6.5
Flexbox: The complete guide,35,189,7,3.7037037037037033,1
How to Safely Copy and Move Your WordPress Website,60,1419,38,2.6779422128259336,1.5
AngularJs :basics for beginners,45,1237,16,1.2934518997574778,1
JSON For Beginners: A Very Basic Introduction,65,1703,27,1.5854374633000587,1
Learn SASS and improve your CSS,55,1849,29,1.5684153596538668,3
Angular Tutorial For Beginners,Free,5397,112,2.075226977950713,2.5
HTML and CSS for Absolute Beginners,Free,4410,52,1.179138321995465,3
"JavaScript, jQuery and Ajax",20,1554,30,1.9305019305019304,4
Laravel Blog Development Starter,Free,4499,138,3.067348299622138,2
React: Learn ReactJS Fundamentals for Front-End Developers,55,1993,55,2.7596588058203713,4
JavaScript For Absolute Beginners - Level Two,30,424,85,20.047169811320757,1
How To Create A Real Estate Website With Wordpress 2017,Free,3782,32,0.8461131676361713,1.5
The Complete HTML5 and CSS3 Course - with 8 Websites Design,30,1551,42,2.7079303675048356,7.5
Introduction to Modern Programming with PHP,20,954,183,19.18238993710692,16
HTML Introduction Course: Learn HTML in 2 hours!!!,Free,7304,368,5.038335158817087,2
Learn HTML & CSS: How To Start Your Web Development Career,Free,15462,689,4.456085887983443,4.5
React vs Angular vs Vue.js by Example,Free,6958,132,1.8970968669157804,3.5
Create WordPress Plugins,50,964,19,1.970954356846473,2.5
Build and Deploy a LAMP server on AWS,Free,3571,18,0.504060487258471,1
Build your own Beautiful Blog in WordPress + SEO,200,2421,6,0.24783147459727387,3
AngularJS Authentication: Secure Your App with Auth0,Free,21689,1080,4.979482687076398,1
Learn Bootstrap 4 by Example,Free,5542,54,0.9743774810537712,1
Complete WooCommerce Plugin Tutorial For Wordpress 2017,Free,7922,183,2.310022721534966,1.5
How To Build And Make A Wordpress Website From Scratch 2017,Free,7055,166,2.3529411764705883,2
Docker for Developers - Newest Version 1.12 with Swarm Mode,95,767,104,13.559322033898304,5.5
Angular Material - Quickstart,Free,3766,135,3.5847052575677116,0.7
HTML and CSS for Beginners - Build a Website & Launch ONLINE,Free,70773,5660,7.997400138470885,6
"Core: A Web App Reference Guide for Django, Python, and More",195,2497,98,3.9247096515818978,26
"JSON with Java APIs, jQuery and JSON REST Web Services",95,799,87,10.888610763454318,6
Bootstrap 4 Quick Start: Code Modern Responsive Websites,Free,41478,2104,5.072568590578138,3
Learn Symfony 3 framework by practical examples,125,867,177,20.415224913494807,4
"Complete Web Development with HTML, CSS and Javascript",Free,2097,16,0.7629947544110633,2
Web Hosting Introduction: How to Publish Your Website Online,Free,5533,137,2.47605277426351,1
Django For Beginners,175,534,16,2.9962546816479403,4
Introduction to QGIS Python Programming,85,197,26,13.19796954314721,3.5
Learning Object-Oriented JavaScript,75,533,54,10.131332082551594,3
Bootstrap Tutorial for Beginners,20,1036,27,2.606177606177606,2
Learn Bootstrap3 With Multi Purposes Single Page Layout,Free,4503,146,3.242282922496114,21
HTML for Beginners,Free,8592,336,3.910614525139665,2.5
How to Build WordPress Themes: A Web Designer's Guide,165,183,30,16.39344262295082,5.5
XML DTD :basics for beginners,35,903,3,0.33222591362126247,0.55
Learn to make an HTML 5 website with a video background,80,1236,18,1.4563106796116505,0.5
Learn Authentication With ASP.NET Identity Security 2017,50,305,45,14.754098360655737,2
HTML and CSS Foundations,Free,1544,15,0.9715025906735751,1
Python Web Programming,100,1020,46,4.509803921568627,6
Build a Complete Registration and Login System using PHP MVC,80,325,50,15.384615384615385,5
ES6 / EcmaScript 6 for beginners an introduction,Free,3227,19,0.5887821506042764,2
React for visual learners,20,659,64,9.711684370257966,3.5
Learn to Create Advance Responsive Websites With Bootstrap,20,2528,15,0.5933544303797469,2
Master the Art of Web Design with HTML & CSS,145,550,15,2.727272727272727,3
Sell Courses On Your Own Website - No Coding Required!,100,1032,9,0.872093023255814,1
Implementing a Data Warehouse with SQL Server 2012 ,85,1142,148,12.95971978984238,5
Learning 200 jQuery Functions with 800 Examples,195,1766,38,2.1517553793884483,18.5
Create Complete Web Applications easily with APEX 5,30,912,128,14.035087719298245,7
"Learn Gulp, The Streaming Build System",25,1305,38,2.9118773946360155,1.5
Perfect React JS Course - Understand Relevant Details,200,653,20,3.0627871362940278,1
Create a classified website in 2 hours - guaranteed,50,3411,84,2.4626209322779244,1
Learn HTML And CSS From Scratch,Free,11533,240,2.0809849995664615,2
Become a Certified Web Developer - Beginner to Expert,200,3397,12,0.3532528701795702,8
Complete Bootstrap 4 course - build 3 projects,Free,7865,241,3.0642085187539734,5
Up and Running with Phalcon,20,715,12,1.6783216783216783,1.5
HTML : HTML Awesomeness,25,988,23,2.327935222672065,0.63
Build CRUD Application - PHP & Mysql,Free,4405,71,1.611804767309875,1.5
All You Need To Know About AngularJS - Training On AngularJS,50,1936,88,4.545454545454546,5
PSD To a Creative Landing Page Using Twitter Bootstrap 3,Free,11666,546,4.680267443853935,4
Ready for Production with Spring Boot Actuator,55,361,26,7.202216066481995,2.5
AngularJS For Beginners,Free,30531,1948,6.38040024892732,3
Learning Path: Akka: Building Applications and Microservices,200,88,8,9.090909090909092,4.5
Set up a localhost Web Server for Faster Website Development,30,55,13,23.636363636363637,1.5
Mastering Meteor: Reactive Full Stack JavaScript,95,494,46,9.31174089068826,3
Build A Professional Wordpress Website In An Hour,20,1294,11,0.8500772797527048,1
Build a file hosting/sharing site in less than 2 hours ,20,976,29,2.971311475409836,1.5
Introduction to Java Programming for Online Learners,200,1586,87,5.485498108448928,22
Create full featured Landing Page in Ruby on Rails in 3 hour,30,1550,15,0.967741935483871,3
How to create a  video blog with WordPress,25,1209,8,0.6617038875103392,4.5
PHP For WordPress Development,35,850,12,1.411764705882353,1
Create a Professional Website Without Programming/Coding,Free,5421,93,1.715550636413946,1.5
How to Build an Autocomplete System Like Google,30,255,5,1.9607843137254901,1
Master EmberJS : Learn Ember JS From Scratch,120,707,59,8.345120226308344,6.5
How To Make A Modern Wordpress BLOG 2017! Create Your Blog!,Free,6856,137,1.9982497082847142,2
Learn Top Ten PHP FrameWorks By Building Projects,60,1007,96,9.533267130089374,17.5
How to Make a Video Blog Website From Scratch w/ Wordpress ,Free,12952,163,1.2584928968499074,1
Build Websites And Apps By Outsourcing,20,2299,11,0.4784688995215311,2
Learning Path: Web Applications with Spring and Angular,200,19,2,10.526315789473683,4
Learn Ruby on Rails By Building Projects,60,1736,79,4.550691244239631,13
Canvas image Creator HTML5 JavaScript project from Scratch,100,2195,10,0.45558086560364464,3.5
Javascript Essentials,Free,47062,5590,11.877948238493902,8.5
Devtools 2017: The Basics of Chrome Developer Tools,Free,4569,108,2.3637557452396587,1
Chrome Extensions : Develop 5 chrome extensions from scratch,Free,3655,85,2.3255813953488373,2
Learn how to quickly build websites using Wordpress,Free,15715,406,2.5835189309576836,3.5
Advance Unix : File Processing: AWK | SED | GREP | CUT | VIM,75,578,40,6.920415224913495,5.5
Develop a Professional OnePage WordPress site With No Coding,20,1747,13,0.7441327990841442,1.5
PHP Specialist (2017 Edition),100,197,11,5.583756345177665,3.5
Python Programming: Create an Digital Marketplace in Django,195,4198,145,3.454025726536446,26
Create Ajax Chat App with PHP & Mysql,45,540,11,2.037037037037037,1
Mastering Thymeleaf with Spring,75,942,161,17.091295116772823,4.5
Learn Rails Programming in Less than 2 Hours,35,2470,24,0.9716599190283401,2.5
Wordpress Backup & Restore,95,478,37,7.740585774058577,1.5
Learn JavaScript Dynamic Interactive Projects for Beginners,100,2558,12,0.46911649726348714,3
Build Modern Websites Super Fast,25,2178,22,1.0101010101010102,1.5
SAP - Learn SAPUI5 Professional Development,195,860,201,23.372093023255815,7
Wordpress Security,95,2888,26,0.9002770083102494,2.5
Learn HTML5 At Your Own Pace. Ideal for Beginners,50,3026,60,1.982815598149372,7
Build an Amazon clone: Nodejs + MongoDB + Stripe Payment,20,2164,290,13.401109057301294,8.5
Build Real World Websites from Scratch using HTML5 and CSS3,195,10874,114,1.0483722641162405,7.5
How to become an App Developer,200,1935,17,0.8785529715762275,1
"Modern JavaScript: Building Real-World, Real-Time Apps",50,1871,154,8.230892570817744,13.5
JavaScript Introduction to Object Oriented JavaScript,90,7789,59,0.7574784953139042,1.5
Core HTML How to get online quickly HTML to HTML5 ,90,10394,33,0.3174908601116029,3.5
Building Websites JavaScript and the DOM,120,17759,64,0.3603806520637423,3
Complete Login and Registration System in PHP and MYSQL,200,4714,149,3.1607976240984303,4
The Complete E-Commerce Web Developer Course 5.0,195,3209,58,1.8074166406980368,12.5
HTML5 canvas Bootcamp for beginners 25 easy steps,120,14118,30,0.21249468763280915,2
Advanced HTML5 Tutorial for Web Developers,50,11847,57,0.48113446442137253,7.5
Learn the Basics of Programming for Marketers,55,11339,43,0.3792221536290678,3.5
Css For Beginners,85,1156,13,1.124567474048443,2.5
GRUNT js: Automate web development tasks and save your time,55,1534,33,2.1512385919165578,1.5
Mastering Web and Mobile Debugging Using Chrome Dev Tools,195,1102,12,1.0889292196007259,2
HTML : Beginner Guide to HTML writing,20,783,20,2.554278416347382,0.62
Build Web Apps Using EmberJS: The Complete Course,40,627,126,20.095693779904305,4.5
SharePoint 2013 Development using C# - Part I,50,891,101,11.335578002244668,8.5
SAP Crystal Reports with ASP.Net (Step by step),Free,7484,304,4.061998931052912,1
Building Responsive Data Visualizations with D3 JS,85,876,59,6.735159817351597,2
Learn Rails Programming in Less than 30 Minute - Lite,20,1235,25,2.0242914979757085,0.63
SASS - Beginner Crash Course,25,1143,34,2.974628171478565,1
Angular 2 Fundamentals for Web Developers,40,450,61,13.555555555555557,6
Easily Learn Web Development With Drop & Drag: OptimizePress,20,1442,9,0.624133148404993,2
XML XSLT - Crash Course for Beginners,45,426,4,0.9389671361502347,1
Create Your Own Successful Online School To Sell Courses,95,2814,14,0.4975124378109453,2
Flask Tutorial Step by Step,Free,4645,171,3.681377825618945,2
Ruby on Rails a Beginners Guide ,Free,13130,346,2.6351865955826352,6.5
Mastering Basic CSS Selectors.,Free,3933,23,0.5847953216374269,3
Create a Website Similar to Facebook from Scratch!,25,2197,9,0.40964952207555755,1.5
Comprehensive TypeScript,125,1318,78,5.918057663125948,4.5
"Essential HTML, CSS & HTML5 Training",50,1553,35,2.2537025112685125,5.5
HTML 5 and CSS 3 - tricks and workarounds,80,2007,10,0.4982561036372696,5.5
"How to Register a Domain, Set Up Hosting, and Edit Web Pages",45,1540,19,1.2337662337662338,3
WordPress Plugins Treasure Chest,25,1655,10,0.6042296072507553,3
Practical Understanding of PHP and MySQL,Free,12201,217,1.7785427423981641,5.5
"AngularJS for Beginners, Single-Page Applications Made Easy",200,1284,46,3.582554517133956,1.5
Building a Social Network in PHP & MySQL From Scratch,50,869,125,14.384349827387801,14
XML DOM - Crash Course for Beginners,45,396,6,1.5151515151515151,0.57
Create a Powerful Website with the Cool Bootstrap Framework,Free,7142,41,0.5740688882665921,4
HTML5 and CSS3 -Start building beautiful websites,150,1414,14,0.9900990099009901,2.5
