Title,Price,Subscribers,Reviews,% of Subscribers who Left Reviews,Length (Hrs)
Getting Started as a Web Developer,Free,9833,241,2.4509305400183057,1
Learn Laravel: Create Your Web App Step-By-Step,45,604,47,7.781456953642383,4
Professional Web Scraping with Java,50,685,37,5.401459854014599,1
3D Programming with WebGL and Babylon.js for Beginners,200,549,49,8.925318761384334,2
Learn to make a colorful one page website,200,1220,16,1.3114754098360655,0.57
WordPress Plugin Tutorial,40,1588,8,0.5037783375314862,0.57
Introduction to HTML,Free,8371,212,2.532552861067973,1.5
Learn JavaScript From Scratch:Become Top Rated Web Developer,65,2570,17,0.6614785992217899,5
"Installing Wordpress 4 - Installation, Registrars & Hosting",45,6117,188,3.0734019944417197,2.5
Learn PHP Programming for Absolute Beginners,35,5368,78,1.4530551415797317,2
WordPress for Beginners 2017 + Google AdSense Implementation,195,2225,14,0.6292134831460674,6.5
JavaScript for beginners in 1 hour,95,2086,56,2.684563758389262,1
HTML5 and CSS for Beginner To Expert,20,1732,15,0.8660508083140877,4.5
Become a Kick-Ass Web Developer: From Newbie to Pro,200,6751,44,0.651755295511776,48.5
Django Tutorial: Build Your First App Fast & Free! ,20,5228,180,3.442999234889059,2.5
Create a social network using PHP Mysqli HTML Css and JQuery,40,1477,17,1.1509817197020988,6
PHP - Send and Receive Mobile Text Messages (SMS),50,1626,81,4.981549815498155,1.5
Complete PHP Course with OOP Start to Finish!,200,4529,54,1.1923161845882093,2
Coding Made Easy: HTML & CSS For Beginners,40,3254,92,2.8272894898586354,1.5
WordPress Security - The Ultimate Security Guide,60,2267,17,0.7498897220996913,1.5
How to Make a Single Page Website for Freelancers & Agencies,Free,17463,283,1.6205692034587413,1.5
Learn to Use jQuery UI Widgets,Free,23669,521,2.2011914318306647,1
Learn to Create Responsive Layouts in 30 Minutes,Free,5301,174,3.2823995472552348,0.5
Web Building Starter Pack. Html Css and JQuery Animations,30,1033,16,1.5488867376573088,7.5
Getting Started with Angular 2+,Free,6909,401,5.804023737154436,2
Intro to PHP Web Application Development with Symfony,200,4040,72,1.782178217821782,1.5
Learn OAuth 2.0 - Theory and Hands On,145,546,69,12.637362637362637,3
Learning CSS3 - A Comprehensive Tutorial For Web Developers,50,2459,107,4.351362342415617,8
Professional WordPress Theme Development from Scratch,200,1284,173,13.473520249221183,25.5
PHP Zend Framework 1.11:Creating a CRUD Application,40,1122,5,0.4456327985739751,0.58
Write quicker HTML5 and CSS 3; productivity hacks with emmet,Free,13016,286,2.1972956361401352,1.5
The Ultimate jQuery Course,20,1098,15,1.366120218579235,2.5
Build an Advanced Single Page with Bootstrap & WordPress,95,481,75,15.592515592515593,6
Master all PHP ideas 2017 to build any project,50,376,19,5.053191489361701,3
A Beginner's Guide to the Meteor JavaScript Framework,50,898,132,14.699331848552339,2
Create an E-commerce website without any coding,20,1393,40,2.8715003589375447,0.52
Learn To Build Apps Using Play Framework,40,434,69,15.898617511520738,5.5
Introducing Ionic 2,50,394,78,19.796954314720814,1.5
Learn Laravel with Database Migration & Seeding & Faker,20,263,14,5.323193916349809,1
Create a Client Network by Hosting WordPress Sites,35,1061,8,0.7540056550424128,1
Introduction to PHP Slim Microframework,20,1312,19,1.4481707317073171,1
ASP :basics for beginners,35,764,7,0.9162303664921465,1
"WordPress Development With NodeJS, Gulp, Composer & More",25,289,30,10.380622837370241,4
Become PHP Facebook Developer: Password-Less Authentication,195,4001,8,0.1999500124968758,4
How To Create Your Very First Website With HTML and CSS,100,5097,196,3.84539925446341,2
Learn JSON for beginners with JavaScript,200,3193,10,0.31318509238960224,1.5
Ultimate guide to Social Media Web development integration ,200,11011,13,0.11806375442739078,2.5
A Complete Laravel basics from beginner to expert,25,3492,61,1.7468499427262314,1.5
JQuery Basics - Learn JQuery From Scratch,100,3559,24,0.674346726608598,1
Learn MeteorJS By Building 10 Real World Projects,50,2784,221,7.9382183908045985,15
JavaScript Basics for Beginners Introduction to coding,150,5495,52,0.9463148316651502,1.5
AngularJS Masterclass - Deep Dive & Understand AngularJS,100,2912,309,10.611263736263735,6
HTML5 for beginners,195,9687,59,0.6090636936099928,5
All in one HTML CSS and JQuery,20,3444,35,1.0162601626016259,3
Responsive Design with NEW Materialize,75,12629,88,0.6968089318235807,1.5
Create a Responsive Business Website with WordPress,95,1659,73,4.400241109101868,5.5
PHP webservices,30,1305,25,1.9157088122605364,0.57
JavaScript Promises: Applications in ES6 and AngularJS,75,651,52,7.987711213517665,2.5
Learn to build 20 websites and build 14 iOS9 apps with swift,40,1926,9,0.46728971962616817,22.5
Professional CSS Flexbox,35,396,130,32.82828282828283,0.72
XML :basics for beginners,40,1062,12,1.1299435028248588,0.65
How to create Paypal and Credit card Payment Buttons,65,578,6,1.0380622837370241,1
Customizr - Learn WordPress with the ultimate creative theme,Free,4735,81,1.7106652587117213,5
How To Create a Local Wordpress Environment,Free,4306,163,3.785415699024617,0.52
Fun and creative web engineering with Python and Web2py,Free,10917,319,2.9220481817349087,2
WordPress for Beginners - Build Your First Website in 2017,100,1701,125,7.348618459729571,7
Learn to Make an Animated Image Gallery using HTML5,Free,11080,165,1.4891696750902528,1
Projects in Foundation Framework - Learn By Building 10 Apps,50,636,33,5.188679245283019,10
Drupal for Beginners,30,1478,18,1.2178619756427604,5
Laravel : CRUD Application Using AJAX In Laravel 5.3,20,362,19,5.248618784530387,1
Foundations of Front-End Web Development,Free,8337,300,3.5984166966534725,20.5
Angular 2 - Superheroic Framework,20,702,21,2.9914529914529915,3
Social Network Web Development,200,2698,29,1.0748702742772425,8
For Free - Deploy Quickly Spring Boot on Heroku With MySQL,95,177,19,10.734463276836157,1
Building Web Applications with Spring MVC,85,714,48,6.722689075630252,3
"HTML5, CSS3 & Bootstrap - How to Create a Responsive Website",20,1062,20,1.8832391713747645,3.5
HTML & CSS - Learn to build sleek websites ,55,1552,14,0.902061855670103,3.5
Master Angular 2 - The No Nonsense Course,25,102,27,26.47058823529412,2.5
Master ASP . NET 4 from scratch,50,613,135,22.02283849918434,16
CoffeeScript: The Good Parts—Write Better javaScript,50,2152,19,0.8828996282527881,2.5
Mastering Magento,85,1063,101,9.501411100658514,3.5
Ultimate JavaScript Strings,Free,3142,117,3.723742838956079,0.62
Your Own Site in 45 Min: The Complete Wordpress Course,120,1566,29,1.8518518518518516,4
Redirect Your Visitors By Country Easily -Wordpress Tutorial,20,2306,3,0.13009540329575023,1
Learn Knockout JS Framework from GroundUp,40,633,104,16.429699842022117,5
Build Responsive Websites  in an Hour using Portalfin,Free,2859,42,1.4690451206715633,0.73
Master Riot: Learn Riot.js from Scratch,125,299,75,25.08361204013378,3.5
Learn W3.CSS,50,1002,7,0.6986027944111777,0.57
Learning Axure RP,75,631,103,16.323296354992074,4.5
"Complete guide to install Wordpress, PHP on Cloud,AWS or VPS",50,1386,17,1.2265512265512266,3
"Kids Coding -Introduction to HTML, CSS and JavaScript",200,2355,143,6.072186836518047,7
Introduction to Voice Design with Amazon's Alexa,Free,6742,1036,15.366360130525067,0.68
How to Create a Social Network For a Niche-Related Community,100,1853,34,1.834862385321101,2
Webpack 1 & 2 - The Complete Guide,40,252,46,18.253968253968253,6.5
Star Rating Project AJAX with JSON response from PHP MySQL,120,1302,18,1.3824884792626728,1.5
Wordpress for beginners :Build Websites Fast without Coding ,50,1658,72,4.342581423401689,5
ASP.Net MVC Quick Start,Free,15092,1234,8.17651736019083,5.5
Build a Chatbot integrated Website using Bootstrap 4,50,165,13,7.878787878787878,3
How To Create A WordPress Website Without Paying A Developer,20,4333,16,0.3692591737825987,1
PSD to Bootstrap 3 for Beginners using HTML & CSS,20,976,93,9.528688524590164,2.5
Build Advanced Responsive Websites with Foundation 6 & SASS,200,1276,245,19.20062695924765,22.5
Learn Essential Javascript Fundamentals - Lite,20,1476,27,1.8292682926829267,0.65
Learn HTML in 2 hours!,Free,5351,235,4.391702485516726,1.5
Laravel 4 try and enjoy php coding,20,2402,26,1.0824313072439635,2
Wordpress Beginner Tutorial: Build Your First Website,Free,6402,104,1.6244923461418308,1.5
Build Complex Express Sites with Redis and Socket IO,125,223,26,11.659192825112108,3.5
Building a ASP.NET MVC 5 Membership Website,95,654,86,13.149847094801222,25.5
Drupal Views: Introduction to Enhancing Your Drupal Website,105,1262,36,2.8526148969889067,2.5
Bootstrap Bootcamp - Responsive web development- 8 projects,100,253,34,13.438735177865613,7
Self Advertise Using PowerPoint Twitter and Facebook on ios,20,1780,15,0.8426966292134831,0.6
Learning Bootstrap 3 - Tutorial From Infinite Skills,50,1266,90,7.109004739336493,3
Practical Web Development: Make Websites Quickly And Easily,20,2389,7,0.2930096274591879,2
"Learn animation using CSS3, Javascript and HTML5",40,1468,54,3.6784741144414173,2.5
Creating Interactive HTML5 Video,25,838,13,1.5513126491646778,2
Optimizing Wordpress for More Speed and Revenue,Free,2649,16,0.604001510003775,0.58
JavaScript project Learn to create a memory Game and more,95,6000,21,0.35000000000000003,1.5
The Complete JavaScript Bootcamp,195,1839,91,4.9483414899401845,5
JavaScript for Absolute Beginners,20,10689,394,3.6860323697258863,2
Complete JavaScript Course for Beginners with Easy Examples,200,7449,91,1.2216404886561953,4
Angular 2 Master Class with Alejandro Rangel,30,4157,206,4.95549675246572,9.5
Quick learning jQuery web development,150,3388,67,1.9775678866587958,3
Google Blogger Course,60,1343,11,0.8190618019359642,3.5
"Ajax in JavaScript and JQuery, with PHP - Creating Chat App",200,3399,85,2.5007355104442484,1.5
PHP Tutorial: Learn PHP Basic Programming for Beginners,20,2510,21,0.8366533864541833,1.5
Mastering Modern Web Development Using React,195,1537,8,0.520494469746259,2.5
"Full Stack JavaScript: Learn Backbone.js, Node.js & MongoDB",50,6134,93,1.5161395500489077,2
The Essential Web Developer Course - Build 12 Websites,200,9355,390,4.168893639764832,16.5
Build Powerful Websites & Blogs using WordPress - No Coding,20,1024,14,1.3671875,3
Learn to Build Web Apps using UnderscoreJS : Code Like a Pro,40,325,37,11.384615384615385,3.5
Building Web Apps Using Flask and Neo4j,50,166,21,12.650602409638553,2.5
Learn Web Animation the Easy Way: An Intro to SVG and GSAP,50,203,33,16.25615763546798,3
Build Your Own Membership Website With Joomla,95,1134,9,0.7936507936507936,1.5
Learn Spring Security 4 Basics - Hands On,95,216,28,12.962962962962962,2
Display and analyze GIS data on the web with Leaflet.js,100,25,4,16.0,12.5
How to Build a CMS with PHP,50,1096,33,3.010948905109489,1
Responsive Web Design with HTML5 and CSS3 - Introduction,35,770,65,8.441558441558442,8
Master Typescript : Learn Typescript from scratch,95,424,45,10.61320754716981,3.5
XSD :basics for beginners,35,755,0,0.0,0.7
Angularjs-WebApi2-EFCodeFirst Web App On 3-Tier Architecture,60,652,48,7.361963190184049,6.5
Css Positioning For Absolute Beginners: A Basic Introduction,65,4797,97,2.0220971440483635,1
Creating User Authentication System in CodeIgniter,200,2783,9,0.32339202299676606,1.5
How to easily Manage your WordPress Website,20,8462,50,0.590876861262113,2
Wordpress For Beginners: Create a Professional Website,200,5129,183,3.567946968219926,1.5
"Building a Portfolio in 90 minutes ( HTML, CSS, Js ) ",20,5272,111,2.10546282245827,2
Automate Web Development With Gulp JS,20,2784,425,15.265804597701148,3.5
Bootstrap 4 Responsive Web Design and Development,20,3086,17,0.5508749189889824,7.5
Intro To HTML & CSS: Web Development For Beginners,20,6008,203,3.3788282290279628,4
Become Exceptional in HTML and HTML5,20,16486,86,0.5216547373529055,6.5
Become a Rockstar Web Developer - Learn By Coding,200,2076,125,6.021194605009634,11
Spring 4 Mastercourse: Covers Annotation & XML Configuration,200,1353,53,3.917220990391722,23.5
WordPress Plugin Development for 2017 - Build 14 Plugins,50,3770,108,2.864721485411141,7
Single Page Application of MVC 5 Using AngularJS,20,722,53,7.340720221606649,1.5
"Learn to Code in HTML5, CSS3, and JavaScript",20,1404,7,0.49857549857549854,2.5
Web Application Development - Learn by Building 3 Web Apps,30,1688,16,0.9478672985781991,1.5
Rails Ecommerce App with HTML Template from Themeforest,25,214,34,15.887850467289718,2
Writing CSS with {LESS} - Tutorial From Infinite Skills,50,788,21,2.66497461928934,2
Login and Registration from Scratch with PHP and MySQL,20,1128,77,6.826241134751773,2
Getting Started with Magento,85,608,88,14.473684210526317,3.5
Ruby on Rails Foundations,20,359,45,12.534818941504177,6.5
Core Concepts in HTML 5,75,1532,19,1.2402088772845952,2
Learn Azure Cloud Step by Step,20,791,29,3.6662452591656134,2.5
Learn Facebook Flux Architecture for Web Applications,40,395,26,6.582278481012659,6.5
"Create free, fast and secure static website",50,322,9,2.7950310559006213,0.52
Object Orientation in PHP,20,151,40,26.490066225165563,5
Creating Custom Web Maps,50,208,48,23.076923076923077,2
Build A YouTube Downloader With C# And GitHub,20,385,39,10.129870129870131,2.5
Querying Microsoft SQL Server 2012 - (Exam No. 70-461),85,666,89,13.363363363363364,6.5
HTTP Clients with Laravel: Use and Consume Services and APIs,65,237,22,9.282700421940929,3.5
Modern E-Commerce Store In php & mysqli With Bootstrap,50,240,45,18.75,66.5
Simple And Easy: Wordpress For Beginners,Free,5014,196,3.9090546469884324,3
Create Website from scratch in Urdu & Hindi,Free,3033,91,3.0003297065611605,1
Advance Unix : File Processing: AWK | GREP | VIM,20,458,2,0.43668122270742354,1
Introduction to Node.js Development,55,1779,48,2.6981450252951094,1
Advance JavaScript for Coders: Learn OOP in JavaScript,40,334,41,12.275449101796406,11.5
Web Development With Google Maps,50,222,9,4.054054054054054,8.5
jQuery UI Ultimate:Design Amazing Interfaces Using jQuery UI,145,422,86,20.379146919431278,12.5
Learn Spring Security 4 Intermediate - Hands On,95,227,16,7.048458149779736,2
Learning Path: The Road to Elasticsearch,200,50,5,10.0,5
HTML/CSS Bootcamp,40,194,26,13.402061855670103,10
JavaScript High Performance,95,458,28,6.11353711790393,4.5
Node:js : Building Rest Apis with Sails.js,100,61,9,14.754098360655737,2
Fundamentals of Angular 2 Full Stack Design,95,314,43,13.694267515923567,6.5
Create Newsletter Subscription Form with PHP/AJAX in 40 Min,50,586,10,1.7064846416382253,0.63
AppML :basics for beginners,30,770,0,0.0,0.63
How to manage your own VPS and create websites,120,735,16,2.1768707482993195,1.5
Learn BuddyPress: Build A Social Network with WordPress,20,1299,15,1.1547344110854503,1
HTML FOR BEGINNERS,20,791,8,1.0113780025284451,1
XML XQuery - Crash Course for Beginners,45,426,4,0.9389671361502347,1
Simplified Cross Browser Web Testing Using VirtualBox,20,796,3,0.37688442211055273,1
JavaScript and jQuery Basics: Start The Journey,25,1316,22,1.6717325227963524,5
How to Install WordPress From Scratch,Free,8415,56,0.6654783125371361,1
CSS :basics for beginners,30,1085,8,0.7373271889400922,0.53
"WordPress Development - Themes, Plugins & Single Page Apps",150,817,164,20.0734394124847,19.5
Learn Effective HTML in No Time!,40,1275,11,0.8627450980392156,1
HTML5 Geolocation in Depth:Build 7 HTML5 Geolocation Apps,90,1526,72,4.718217562254259,6.5
Building a Search Engine in PHP & MySQL,Free,10110,379,3.7487636003956477,2.5
create a search engine for your website!,20,1832,6,0.32751091703056767,1.5
Learn basics of HTML in 30 Minutes,20,945,17,1.7989417989417988,0.55
JavaScript from Scratch for Very Beginners,30,1272,31,2.4371069182389937,5
Learn Web Development by Creating a Social Network,200,442,48,10.85972850678733,6.5
CSS Image filters - The modern web images color manipulation,Free,6315,53,0.8392715756136183,1.5
Building Responsive Websites with Bootstrap 3 Framework,75,1322,14,1.059001512859304,3
Create a Membership Site with Wishlist Member & Wordpress,95,557,39,7.001795332136446,2.5
Convert HTML Websites into PHP: Learn by Doing in 40 Minutes,50,540,13,2.4074074074074074,0.6
17 Complete JavaScript   projects explained step by step,185,327,26,7.951070336391437,9.5
Mastering Unix : AWK Commands,20,358,0,0.0,2
Cakephp:Creating a CRUD application,40,803,2,0.24906600249066002,0.52
HTML and CSS: A Guide to Web Design,25,1557,13,0.8349389852280027,14
Drupal 8 Site Building,Free,1942,23,1.184346035015448,4.5
Learn Bootstrap 4 The Most Popular HTML5 CSS3 & JS Framework,200,279,37,13.261648745519713,10
Essentials of Spring 5.0 for Developers,125,34,2,5.88235294117647,1.5
The Extreme Web Development Course - For Beginners,200,1420,62,4.366197183098591,5.5
JQuery DOM and Ajax Concept Explained for Beginners,35,1812,112,6.181015452538632,0.62
HTML Forms For Beginners: A Basic Introduction  ,45,2472,41,1.6585760517799353,1
Ultimate JavaScript Objects,20,1525,43,2.819672131147541,2.5
The Complete Web Developer Course - Build 20 Websites,20,2650,61,2.30188679245283,15.5
"Simple Javascript: Learn by Doing, Beginners Welcome!",25,2753,10,0.3632401017072285,2
"Learn HTML, CSS, and Ruby on Rails: Build Your First Blog",20,2985,40,1.340033500837521,1.5
Learn HTML5 Canvas for beginners,100,2360,12,0.5084745762711864,3.5
Bootstrap 4 Beginners: Code a Responsive Landing Page,30,948,193,20.35864978902954,3.5
Build Wordpress CMS Clone with Laravel 5,150,392,81,20.66326530612245,8.5
XML DTD - Crash Course for Beginners,45,944,1,0.1059322033898305,1
Beginner Photoshop to HTML5 and CSS3,Free,73110,1716,2.3471481329503487,2
XPATH :basics for beginners,40,878,6,0.683371298405467,0.62
The Fastest Way to Create a Website Using Godaddy,30,1454,14,0.9628610729023385,0.5
A how to guide in HTML,Free,7318,205,2.801311833834381,0.58
Building Better APIs with GraphQL,50,555,89,16.036036036036037,2.5
Learn Grunt with Examples: Automate Your Front End Workflow,20,496,113,22.782258064516128,1
Build A Stock Downloader With Visual Studio 2015 And C#,20,436,36,8.256880733944955,1.5
jQuery UI in Action: Build 5 jQuery UI Projects,150,382,28,7.329842931937172,15.5
Learn jQuery from Scratch - Master of JavaScript library,100,1040,14,1.3461538461538463,2
How To Design A WordPress Website With No Coding At All,25,306,3,0.9803921568627451,3.5
Learn and Build using Polymer,40,513,169,32.94346978557505,3.5
CSS Animations: Create Amazing Effects on Your Website,50,300,31,10.333333333333334,3
Using MODX CMS to Build Websites: A Beginner's Guide,45,901,36,3.9955604883462823,2
