Title,Price,Subscribers,Reviews,% of Subscribers who Left Reviews,Length (Hrs)
Pimcore Developer: Implement a Blog from a Bootstrap Theme,95,1212,15,1.2376237623762376,4.5
Inspirational Web Development - A Beginner Approach -,20,5328,47,0.8821321321321322,3.5
"Learn HTML, A practical guide from scratch to HTML 5",100,5715,52,0.9098862642169728,3
JavaScript Tutorial: Learn JavaScript Code for Beginners,20,2074,14,0.6750241080038573,1.5
Website Secrets: Get a Gorgeous Website on the Cheap,50,12328,15,0.12167423750811161,2
Ultimate WordPress Plugin Course,100,4537,415,9.147013445007714,9
PHP for Beginners: How to Build an E-Commerce Store,100,5117,463,9.048270470979089,14.5
"Build Realtime Apps | React Js, Golang & RethinkDB",60,3854,482,12.506486766995328,3
"Master Electron: Desktop Apps using HTML, JavaScript & CSS",165,1902,224,11.77707676130389,5.5
The Complete Web Developer Masterclass: Beginner To Advanced,195,37141,1813,4.881397916049648,51
Mastering Micro Services Using Java Spring Boot,195,1649,34,2.0618556701030926,2
How to Create A Website: An HTML Tutorial and CSS Tutorial,65,3012,260,8.632138114209829,32.5
The Advanced Web Developer Course,100,6890,99,1.4368650217706822,10.5
Projects in MongoDB - Learn MongoDB Building Projects,50,4628,247,5.337078651685393,12
Learning JavaScript Programming Tutorial. A Definitive Guide,50,17113,380,2.220534096885409,9.5
"The Complete JavaScript, HTML and CSS Tutorial For Beginners",35,244,44,18.0327868852459,3
"Build Modern Responsive Website With HTML5, CSS3 & Bootstrap",195,1472,210,14.266304347826086,13
The Complete JavaScript Course For Web Development Beginners,195,31499,450,1.4286167814851265,4
Email Marketing: Send Unlimited Emails via Own Mail Server,35,3539,43,1.2150324950551004,1
Getting started with JavaScript,200,1415,17,1.2014134275618376,1.5
Learn the basics of the Web development: Coding Tactics,40,2965,17,0.5733558178752108,2
RESTful API with Laravel 5.4: Definitive Guide,145,655,95,14.50381679389313,12.5
Learn AngularJS Step By Step,20,18777,1112,5.922138786813655,1.5
Learn React : The World's Most Lucrative JavaScript Library,50,1591,99,6.222501571338781,9.5
Master Regular Expressions from scratch - All languages,70,1925,27,1.4025974025974026,2
Try AngularJS: Beginner's Guide to Front End Web Development,50,16926,126,0.7444168734491315,4.5
JavaScript Step by Step how to apply it to your web pages,100,13406,78,0.5818290317768163,1.5
Explore JavaScript Beginners Guide to Coding JavaScript,200,5739,26,0.45304059940756225,2.5
Learn Web Scraping with Node.js,75,16731,137,0.8188392803777419,1
Getting Started with WordPress 2016,20,1613,21,1.301921884686919,1
Learn HTML5 Programming From Scratch,Free,268923,8629,3.2087251741204734,10.5
Getting Started with LESS - Beginner Crash Course,25,1780,69,3.876404494382023,1.5
Master ECMAScript 2015 (ES6),Free,7438,441,5.929013175584834,2.5
Learn to Setup Websites from Scratch,Free,21087,154,0.7303077725612936,3.5
Create Fast RESTful APIs with Lumen and Homestead by Laravel,60,1157,105,9.075194468452894,3
"Build Modern Websites Quick With HTML,CSS and Bootstrap",20,912,17,1.8640350877192982,4.5
Twitter Integration customize Tweets with developer API,115,2039,7,0.34330554193231977,1
Build a Responsive Website with a Modern Flat Design,Free,16527,354,2.1419495371210746,2
The Ultimate WordPress Boot Camp: Build 7 Websites,125,1000,74,7.3999999999999995,11
Master the Basics of HTML5 & CSS3: Beginner Web Development,Free,26541,750,2.8258166610150335,3
Become A Full Stack Web Developer in 14 Days,195,467,20,4.282655246252676,13.5
Projects In ReactJS - The Complete React Learning Course,50,947,108,11.40443505807814,8
Beginning Web development Learn the basics of HTML,95,9832,71,0.7221318144833198,2
Step by Step Build Your Template by Bootstrap 4 from scratch,80,2184,15,0.6868131868131868,3
Hosting your static website on Amazon AWS S3 service,20,2853,47,1.6473887136347702,1.5
JavaScript Rockstar How to create Incredible Useful code,75,16590,51,0.3074141048824593,2.5
Spring Core DevOps on AWS,100,1626,115,7.072570725707257,6.5
How to Create a Website Without Coding - WordPress 2016,195,9056,96,1.0600706713780919,1.5
PHP Graphic Techniques: CAPTCHA/ Create a verification code,20,8320,73,0.8774038461538461,0.72
Introductory To HTML and CSS,50,4106,112,2.7277155382367266,1
Learn how to convert PSD to HTML and CSS responsive,30,5324,52,0.9767092411720512,2.5
PHP User Login Registration Script With All Features,200,5603,46,0.8209887560235588,4
AJAX : Let's build a COOL project,70,4183,292,6.980635907243606,3.5
Advanced WordPress Topics: Post Types Taxonomies & Metaboxes,95,301,44,14.61794019933555,7.5
Laravel Homestead,Free,3883,110,2.8328611898017,1
The Complete TypeScript Programming Guide for Web Developers,40,236,31,13.135593220338984,4
JavaScript with BackboneJS and Bootstrap CSS - Advanced,25,1758,37,2.1046643913538112,3.5
Ruby on Rails Tutorial: Learn 6 Ruby on Rails SEO Techniques,200,1266,16,1.263823064770932,2
XML DOM :basics for beginners,35,920,1,0.10869565217391304,0.7
Learn HTML Basics From Scratch,Free,5004,52,1.0391686650679457,3
Byte-Sized-Chunks: Dynamic Prototypes in Javascript,20,880,6,0.6818181818181818,3
Build Websites from Scratch with Squarespace,50,342,53,15.497076023391813,3.5
Introduction to web programming for GIS applications,100,205,38,18.536585365853657,13.5
Java Spring Security,40,527,63,11.954459203036052,2.5
Responsive Html5 Theme Development,20,1517,4,0.26367831245880025,1
What’s New in Bootstrap 4,20,130,14,10.76923076923077,0.62
ReactJS Course: Learn JavaScript Library Used by Facebook&IG,50,1018,33,3.2416502946954813,3
Building a Ruby on Rails Application with Neo4j,Free,4830,38,0.7867494824016562,0.53
Sara Learns to Code.  Making an App from Scratch,60,402,20,4.975124378109453,4
Ajax  for Beginners: A Very Basic Introduction,65,755,5,0.6622516556291391,2
Wordpress Essentials: Useful Plugins,25,1087,7,0.6439742410303588,1
Django by Example,125,170,21,12.352941176470589,9
Build A Great Wordpress Website For Your Business in 2 Hours,35,1054,4,0.3795066413662239,2
Wordpress on AWS: The Easy way to AWS for Free Fast hosting ,40,245,23,9.387755102040817,1
Mastering TypeScript,95,353,34,9.631728045325778,3
Mastering AngularJS UI Development,95,464,26,5.603448275862069,1.5
Custom Theme Creation for WordPress using HTML5 and CSS3,35,298,20,6.7114093959731544,1.5
Create a PHP Contact Form in Bootstrap,20,2238,65,2.9043789097408403,1
Introduction To Data Analytics Using Microsoft Power BI,45,1764,33,1.870748299319728,1.5
HTML Made Simple For Beginners: Create a One Page Website,65,3380,50,1.4792899408284024,2
The Complete Web Developer Masterclass: Beginner To Advanced,20,1030,11,1.0679611650485437,2.5
Website Builder Software Previews,25,1406,12,0.8534850640113799,1
Learn How to Create Your Own Social Network,50,4732,5,0.10566356720202875,2
"Learn By Example: The Foundations of HTML, CSS & Javascript",50,1724,72,4.176334106728538,13
JavaScript manipulation of the DOM Document Object Model,20,1618,46,2.843016069221261,1.5
Create Jekyll blog and host it on Github like a Ninja,20,5056,74,1.4636075949367089,2
Learn React JS from scratch,115,1562,42,2.6888604353393086,4
Web Security: Common Vulnerabilities And Their Mitigation,50,1547,30,1.9392372333548804,8
PHP for Beginners,40,2626,95,3.6176694592536176,6
Make a professional website - 30 Day Guarantee. Discounted!,20,11167,34,0.30446852332766183,2
Symfony 3: Build a PHP Application with Symfony,20,466,11,2.3605150214592276,2
Learn ASP.Net Web API 2 for Absolute Beginner,30,1355,14,1.033210332103321,3.5
Build a Website in 30 Minutes,95,5065,40,0.7897334649555774,0.53
Google Blogger : How to Create a Blog,20,1763,17,0.9642654566080544,2
How to Make a Website Without Coding- WordPress & Web Skills,30,6413,107,1.6684858880399187,9
Learn WCF And Web APIs From Scratch,50,5398,358,6.632085957762134,10.5
How To Build A Website From Scratch + Blogging Blueprint,20,7017,37,0.5272908650420407,3.5
Learn To Create Different Website Layouts & Media Queries ,195,6510,45,0.6912442396313364,2
Build Sign Up and Login Forms With Bootstrap Modal,20,1898,19,1.0010537407797682,4
"Build a Real Time web app in node.js , Angular.js, mongoDB",20,3299,166,5.031827826614125,4
Superb jQuery Course - Become Certified jQuery Developer,95,817,6,0.7343941248470013,1.5
How To Build A Facebook Messenger Chat Bot From Scratch,120,1798,20,1.1123470522803114,1.5
"Build Your Own Calculator App with Javascript, HTML5 & CSS",50,3688,49,1.3286334056399132,1
The Complete WordPress Development & Customization Course,100,1611,165,10.242085661080075,12.5
HTML CSS Easy steps to create a web template from scratch,200,11574,78,0.673924313115604,1
Learn jQuery AJAX in 1 hour,195,2547,62,2.434236356497841,1
Develop Competitive Plugins for WordPress and WooCommerce,150,2063,18,0.872515753756665,1
Get Results - Core Principles of Web Development Tricks Tips,75,22355,54,0.24155669872511742,1.5
JSON Faster Sleeker & Easier Discover the benefits learn it,200,8577,69,0.8044770898915705,1.5
Get to know HTML Learn HTML Basics,200,10674,102,0.9555930297920181,2
Ultimate Css & JQuery Form Designing From Beginner to Expert,115,783,5,0.6385696040868455,1
PHP: Complete Registration and Login with Email Verification,20,12781,145,1.134496518269306,2.5
JavaScript from Beginner to Expert,125,5484,439,8.00510576221736,12.5
Build a website HTML5 CSS3 Beginner Course,150,7884,44,0.5580923389142567,2
Learn Ruby on Rails: Stripe Payment Processing,40,15724,33,0.20987026201984227,1.5
WordPress For Beginners | No Coding Required,20,3106,31,0.9980682549903412,1
jQuery For Beginners : A Basic Introduction,65,6293,165,2.6219609089464484,1
WordPress Plugins and Widgets,40,8711,29,0.3329124095970612,1
PHP Essential How to create build Amazing websites with PHP,75,8067,30,0.3718854592785422,3.5
HTML CSS JavaScript: Most popular ways to code HTML CSS JS,170,9332,172,1.8431204457779682,3.5
Bootstrap 3 Beginners: Create a Professional Landing Page,20,3271,278,8.498929990828492,2.5
Introduction to Node.js for Beginners,125,1367,17,1.2435991221653255,6
Introduction to Coding with Ruby,45,5077,126,2.4817805790821352,3.5
Complete PHP and MySql Course: From Beginner to Professional,200,6508,137,2.105101413644745,6.5
Angular JS Essentials,195,4687,99,2.11222530403243,4
How To Setup Web Hosting,Free,11758,242,2.0581731587004595,1
"Web Application Development using Redis, Express, and Socket",200,300,16,5.333333333333334,6
How to Start a WordPress Blog - Complete Beginners Guide!,Free,3784,85,2.2463002114164907,2
CSS3 Gradients for Web Designers,20,1209,9,0.7444168734491315,1.5
Learn ASP NET MVC 5 step by step,20,1428,91,6.372549019607843,3
Tumult Hype Pro Basics: HTML5 Animations Made Easier,50,716,32,4.4692737430167595,4
Web Hosting Set Up and WordPress Installation For Beginners,Free,12563,239,1.9024118443047042,0.57
Ruby on Rails 4---A Test-Driven Approach,100,1518,55,3.6231884057971016,19
AJAX :basics for beginners,35,1241,23,1.8533440773569703,0.57
Let's JavaScript!  Code a calculator,35,380,10,2.631578947368421,2
JavaScript from Beginner to Advanced,195,395,18,4.556962025316456,17
WordPress Theme Academy with Bootstrap,20,1169,110,9.409751924721984,7.5
Building a eCommerce Startup in 4 Hours [Livestream],50,1114,8,0.718132854578097,3
Responsive PHP Registration Form: From Scratch,95,5738,9,0.15684907633321715,4
A-Frame WebVR Programming Tutorial Series (Virtual Reality),40,6648,16,0.24067388688327318,1.5
Learn Bootstrap And Make Responsive Websites,25,1605,10,0.6230529595015576,3.5
HTML Web Development Crash Course,20,4848,33,0.6806930693069307,1.5
Bootstrap Basics: Program Responsive Websites,75,4743,393,8.285895003162555,3
Projects with JSON and APIs,20,1520,34,2.236842105263158,2
Web Design HTML CSS How to Create a Website from Scratch,50,3601,28,0.7775617883921133,2
"Create Complete Sign up System using PHP, jQuery and Ajax",200,4033,40,0.9918175055789735,3
Adobe Flash for Beginners - Build Flash Website From Scratch,200,17071,17,0.09958408997715425,1.5
Learn Complete WordPress for Building a Professional Sites,80,13708,92,0.6711409395973155,9
Devtools 2017: Beginner to Expert w/ Chrome Developer Tools,125,430,54,12.558139534883722,2.5
Bootstrap Essential Training - Create Your Very Own Website,20,2643,34,1.2864169504351117,9
Angular 2 Jump Start With Typescript,20,1731,90,5.1993067590987865,4
Learn Plugin Development in WordPress By Building  Projects,60,1313,121,9.215536938309215,11
"Build Your Startup with No Coding (Design, Develop & Ship)",30,775,245,31.61290322580645,8
The Web Developers Guide: Learn HTML & CSS Fundamentals,20,2243,27,1.2037449843958983,7
Learn PHP Programming for Absolute Beginners - Lite,20,2749,62,2.2553655874863585,0.68
Learn Drupal 8 - With a Live Project,55,2012,15,0.7455268389662028,3.5
Supreme NodeJS Course - For Beginners,200,1080,37,3.425925925925926,3.5
CSS3 for beginners,195,3831,15,0.39154267815191857,1.5
Javascript for beginners,75,2071,57,2.7522935779816518,1.5
Become a Bootstrap Expert: Build 20 Layouts!,35,2755,57,2.0689655172413794,17.5
PHP : Learn to upload files to Amazon S3 and use CloudFront,50,1216,36,2.9605263157894735,3
PHP MySQL: Learn PHP MySQL with Project,20,2314,77,3.327571305099395,2
How to Set Up a Self-Hosted Wordpress Website in 30 Minutes,Free,8770,261,2.976054732041049,0.53
Projects in Django and Python,60,1764,53,3.00453514739229,6.5
"Create, Update and Manage Your Own Website Using Drupal 7",120,2837,68,2.396898131829397,7
Learn HTML - The programming language to build a webpage!,25,1655,39,2.3564954682779455,1
Learn To Program JavaScript (in ten easy steps),75,2721,96,3.528114663726571,5.5
Bootstrap :basics for beginners,40,1152,20,1.7361111111111112,1
Introduction to CSS Development,Free,15493,415,2.6786290582843866,2
PHP :basics for beginners,45,1562,4,0.2560819462227913,1.5
Beginning Oracle WebLogic for Administrators,Free,9786,989,10.106274269364398,0.7
Build an HTML5 and CSS3 Website in 35 Minutes,20,1904,25,1.3130252100840336,0.7
Angular 2 Routing: Up And Running,Free,3357,84,2.5022341376228776,0.62
Advanced Prezi: Make Amazing Presentations ,30,2200,25,1.1363636363636365,1
1 hour jQuery,100,5456,133,2.437683284457478,1
The WpFASTER WordPress Speed Optimization Master Course,175,2134,215,10.074976569821931,7
How to Build Your Own Website with WordPress: A Step-by-Step Guide ,95,4675,15,0.32085561497326204,6
Build Apps with ReactJS: The Complete Course,40,1433,145,10.118632240055828,5.5
Learn SASS: from beginner to expert,20,1734,9,0.5190311418685121,1
The complete HTML5 course,20,3461,11,0.31782721756717713,1.5
Create a Responsive Website with Bootstrap 3,50,4076,39,0.9568204121687929,3
Lerning PHP by building website,185,567,63,11.11111111111111,8
Learn PHP Object Oriented Features with Simple Examples,20,1723,28,1.625072547881602,1
Crash Course - Learn to Create a PHP MVC Framework,50,1282,117,9.126365054602184,1
JSON :basics for beginners,45,2052,18,0.8771929824561403,0.55
CSSCasts; CSS libraries Plugins Tips & Tricks for Developers,200,1874,40,2.134471718249733,44.5
Complete Guide to Front-End Web Development and Design,200,1119,111,9.919571045576408,16.5
"Build Ajax Web Apps with Laravel 5.2, Bootstrap and jQuery",100,1023,131,12.805474095796676,5
Javascript for Beginners,20,3697,195,5.274546929943197,3
MongooseJS Essentials - Learn MongoDB for Node.js,Free,21682,1106,5.1010054423023705,0.73
Regular Expressions for Beginners - Universal,100,1975,141,7.139240506329115,3
Learn Redis from Scratch,40,553,84,15.18987341772152,3
WordPress Plugin Development -> Deep dive discovery!,40,2650,19,0.7169811320754716,2
Learn Ajax and jquery with PHP,20,2964,8,0.2699055330634278,1.5
Create a business website with WordPress,50,1624,31,1.9088669950738917,4
DesktopServer : Install WordPress Locally  - Work Anywhere!,65,1640,22,1.3414634146341464,2
Understand PHP Arrays and HTTP Request in a Better Way,35,1627,38,2.3355869698832206,0.58
Mastering CSS,95,1815,249,13.71900826446281,5
The Complete Wordpress Theme Development Guide,25,1011,2,0.19782393669634024,2
The Complete HMTL5 Course - Go From Beginner To Advanced!,95,2430,15,0.6172839506172839,2
Learn Jquery from Scratch 2-Hour Training ,20,5318,56,1.0530274539300488,1.5
How to Create a Wordpress Website from Scratch - No Coding,20,7018,28,0.39897406668566543,3
Learn PHP CodeIgniter Framework with AJAX and Bootstrap,75,1634,52,3.182374541003672,2.5
The Complete Guide to JavaScript Development,110,3590,36,1.0027855153203342,14
Basic HTML CSS and Web Design,30,4030,92,2.28287841191067,9
Build Professional WordPress Website,145,4020,95,2.36318407960199,3.5
Ultimate CSS3 Course - From Beginners To Professional,95,2635,25,0.9487666034155597,2
Code & Grow Rich:  Earn More As An Entrepreneur Or Developer,200,7211,52,0.7211205103314381,57
Learn by Example : ReactJS,50,1496,37,2.473262032085562,7.5
React.js Quickly: Developing Scalable Web User Interfaces,50,4447,76,1.70901731504385,4
JavaScript - Tricks and Workarounds,100,1410,134,9.50354609929078,5
Kids Coding - Beginner HTML,20,6628,53,0.7996378998189498,1
Learn PHP from scratch!!,25,1908,12,0.628930817610063,1.5
PHP with PDO - ULTIMATE Crash Course,50,1248,171,13.701923076923078,1.5
JavaScript for beginners with live examples,195,4587,46,1.0028340963592761,4
Bootstrap 3 Introduction : Create RESPONSIVE Websites Fast,50,2351,302,12.84559761803488,2.5
Laravel(5.2) PHP Framework  Jump Start for beginners,20,3898,95,2.4371472550025657,3
Professional WordPress Theme Development For 2017,20,3185,102,3.2025117739403455,8
Learn Laravel PHP Framework Building Multi User SEO Blog APP,100,557,92,16.517055655296232,9.5
Javascript Specialist,200,408,39,9.558823529411764,8
Write PHP Like a Pro: Build a PHP MVC Framework From Scratch,70,1703,435,25.54315913094539,3
JavaScript Intro to learning JavaScript web programming,20,17554,94,0.5354904864988037,1.5
Crash Course: Fundamentals Of HTML & CSS From Scratch.,20,7368,216,2.9315960912052117,2
"Laravel, the complete guide with real world projects",200,676,119,17.60355029585799,14
VueJS V1 Introduction to VueJS JavaScript Framework,200,3632,28,0.7709251101321586,2
HTML CSS: Essential steps to learn HTML CSS,145,10576,154,1.4561270801815431,2.5
Learn HTML 5 in 1 hour,100,11643,169,1.4515159323198488,1
Learn Html5 & CSS3 from scratch,20,13960,239,1.7120343839541547,2.5
Responsive Web Design: Made Easy,195,5085,106,2.084562438544739,6.5
Parse Server: From Front End to Full Stack,200,1130,162,14.33628318584071,6
Codeigniter: How to use Codeigniter that drives knowledge,150,14606,235,1.6089278378748457,3
jQuery for Beginners - Create Website Animations Easily,100,2971,285,9.592729720632784,3
How to Build Chat Bots: From Beginner to Intermediate,140,2814,107,3.802416488983653,2
Web Development with BootStrap - 16 Instant Themes Included!,40,1355,45,3.3210332103321036,3.5
Install a Wordpress Theme the Correct Way & Charge Others,20,2335,13,0.556745182012848,1
Coding for Entrepreneurs Basic,Free,161029,279,0.1732607170137056,3.5
The CSS and CSS3 Crash Course,150,2051,99,4.826913700633837,13
Build a Business or Personal Website Using Wordpress,200,1069,12,1.1225444340505144,4.5
Learn By Example: PHP For Dynamic Websites,50,1439,10,0.6949270326615705,13
Learn ReactJS: Code Like A Facebook Developer,20,1948,72,3.696098562628337,5
Learn to Build Web Apps using D3JS,40,841,99,11.771700356718192,3.5
How to create awesome website and e-commerce in 1 hour,20,937,4,0.42689434364994666,1
Joomla for Beginners - Learn how to build a website with CMS,95,583,7,1.2006861063464835,3.5
Learning Drupal 8,50,577,97,16.81109185441941,9.5
Learn How To Build a Web Application Without Coding,Free,9364,311,3.32123024348569,0.53
Rock Solid Wordpress Security - Secure Web Development,Free,5052,92,1.8210609659540775,1.5
Mastering JavaScript,95,694,39,5.619596541786744,4
PHP Laravel 5:Creating a CRUD application,45,511,12,2.3483365949119372,0.55
XQUERY :basics for beginners,40,937,2,0.21344717182497333,0.63
PHP Development with the Laravel Framework,50,1611,24,1.48975791433892,3.5
WordPress Development - Themes and Plugins Complete Guide,200,103,11,10.679611650485436,5.5
Basic JavaScript: Build 4 Basic JavaScript Projects,40,670,33,4.925373134328359,4.5
HTML and CSS for Beginning Web Developers,100,1606,28,1.7434620174346203,9
Popular JavaScript Framework:Learn The Language Of Angular 2,200,260,22,8.461538461538462,11
The Ultimate Guide to the Best WordPress Plugins Part 1,50,122,10,8.19672131147541,10.5
XSLT :basics for beginners,35,877,6,0.6841505131128849,0.53
The Complete Wordpress Plugin Development Course - 8 Plugins,200,1215,58,4.77366255144033,2.5
JSON Crash Course for Beginners,45,3323,90,2.708396027685826,0.63
You can create Incredible Websites with HTML CSS learn how,100,11892,50,0.4204507231752439,2.5
JavaScript Tricks how to create code projects from scratch,75,15106,31,0.20521647027671122,1.5
The Sass Course! Learn Sass for Real-World Websites,95,975,141,14.461538461538462,3.5
Web Design How to Create a Website HTML CSS Bootstrap,75,5263,29,0.5510165304959149,2
Master Angular 4 by Example - Build 7 Awesome Apps!,195,596,32,5.369127516778524,8
Create A Custom Responsive WordPress Website For A Client,95,7517,89,1.1839829719302915,4.5
Mastering HTML5 Programming - The Easier Way,75,21653,138,0.6373250819747841,7
How to Launch Your Own Website Builder Service,20,9028,87,0.9636685866194064,1.5
Getting Started with HTML,40,7375,52,0.7050847457627119,1.5
Spring Framework 4 (Java Enterprise JEE) with AngularJS,95,5177,318,6.142553602472475,13.5
Build A Weather App With Ajax Using Open Weather Map API,20,6548,44,0.6719609040928528,4
Essentials of JavaScript Practice Coding Exercises Tips,80,28125,115,0.4088888888888889,2
Learn and Earn with HTML & CSS,20,9349,206,2.2034442186330088,4
Get started Creating Websites Everything you need provided,100,14260,44,0.3085553997194951,3
JavaScript in Action JavaScript Projects,150,7720,58,0.7512953367875648,1.5
Modern Web Development with Laravel 5.2 (PHP Framework),120,2142,536,25.023342670401494,12
Programming for Entrepreneurs - JavaScript,200,12873,106,0.8234288821564515,2.5
Create a Website from Scratch using HTML CSS step by step,75,12882,95,0.7374631268436578,1.5
Complete AJAX Course: Learn AJAX Techniques Using Bootstrap,195,12368,89,0.7195989650711513,3.5
Learn jQuery by Example Course,170,8625,94,1.0898550724637681,5
Bootstrap 4 Theme Development Masterclass,150,2641,28,1.0602044680045437,0.65
Wordpress Theme Development for Beginners,20,1052,14,1.3307984790874523,8
Web Design Creating websites from scratch,75,13920,64,0.45977011494252873,2
HTML Learning the Basics Intro to HTML website coding,20,7416,65,0.8764832793959008,0.65
Learn how to use Javascript Components with PHP and Symfony,90,1822,4,0.21953896816684962,2
So you think you know JavaScript?,50,1010,154,15.247524752475247,6
Learn Node.js by building Udemy: Stripe + MailChimp + Wistia,110,1425,36,2.526315789473684,5.5
Learn jQuery: An In-depth Course For Beginners,50,7014,95,1.354433989164528,4.5
JavaScript for Beginning Web Developers,75,7785,416,5.3436095054592165,4.5
JQuery Create Overlay Popups from scratch using Jquery,50,4407,17,0.3857499432720672,2.5
Vue JS 2: From Beginner to Professional,145,602,93,15.448504983388705,15.5
Ultimate AngularJS: Build a Real-World App from Scratch,100,1712,438,25.58411214953271,5.5
Wordpress Site Migration,20,1894,40,2.1119324181626187,1.5
introduction to HTML Course,20,3258,32,0.9821976672805401,2
Create Single Page Website using Twitter Bootstrap 3,20,7449,111,1.4901329037454691,1
The All-In-One Web Development Course,85,538,13,2.41635687732342,18.5
Code a Responsive Website Using HTML5 and CSS for Beginners,50,1271,136,10.700236034618412,7.5
AngularJS for the Real World - Learn by creating a WebApp,115,1407,137,9.737029140014215,7
Wordpress Tutorial   ,200,2311,8,0.34617048896581565,1.5
Create a REAL Social Network like Facebook in PHP + MySQL,45,1002,178,17.764471057884233,16.5
Advanced Node.js Development,55,2565,32,1.2475633528265107,3
ASP.NET MVC 5 Project - Facebook Clone,30,210,19,9.047619047619047,5
Bootstrap For Beginners: A  Basic Introduction,55,1186,14,1.1804384485666104,0.67
jQuery for Beginners,20,1421,17,1.1963406052076002,4
JavaScript Basics For Web Developers,20,958,14,1.4613778705636742,1
Learn PHP from Scratch,50,1550,25,1.6129032258064515,1.5
Learn Express,25,1309,60,4.583651642475172,1.5
"Build A Web App with VueJS, Spring Framework and MongoDB",145,251,32,12.749003984063744,3.5
Zend Framework 2: Learn the PHP framework ZF2 from scratch,40,723,130,17.98063623789765,6.5
Improved SEO with Rich Snippets and MicroData,Free,11026,228,2.0678396517322692,1
X theme for WordPress: Responsive web design without code!,20,1318,81,6.145675265553869,7
Become a HTML and CSS Developer - Build a Responsive Site,Free,3894,91,2.336928608115049,2
How to Make a Wordpress Website 2017,Free,12293,235,1.9116570405922069,3
Install Wordpress,20,1447,35,2.4187975120939877,0.67
CSS Specialist: Comprehensive CSS Training,100,487,31,6.365503080082135,6
Introduction to Laravel 4,Free,9110,411,4.511525795828759,2.5
Introduction to Elm,Free,1519,28,1.8433179723502304,1
Learn to Freelance with People Per hour  (URDU),20,948,48,5.063291139240507,0.6
Learn Wordpress 4 from Scratch : Create Awesome Websites,75,2023,8,0.3954522985664854,2
Amazon Alexa Development: From Beginner to Intermediate,140,1858,110,5.920344456404736,2.5
The Build a SAAS App with Flask Course,40,2244,365,16.26559714795009,10
Learn JSON with JavaScript Objects and APIs in 1 hour,95,3619,93,2.5697706548770376,1
1 Hour JavaScript,200,22999,602,2.617505108917779,1
Building An E-Commerce Store Using Java Spring Framework,95,2743,589,21.47283995625228,14.5
Typescript Masterclass & FREE E-Book,150,1229,139,11.310008136696501,7.5
PHP MVC Framework CodeIgniter Tutorial for Beginners Project,100,3701,508,13.726019994596056,10.5
